"Fri Dec 15 22:48:34 +0000 2023","1735794001377403229","COVID naik lagi! Ayo Vaksinasi sampai 100 kali!  Lanjutkan kebodohan kalian! https://t.co/32HkDXxu0x","30","179","596","1478","in","1502822366946402304","1735794001377403229","DokterTifa","https://twitter.com/DokterTifa/status/1735794001377403229","https://pbs.twimg.com/media/GBbHchHaoAA___l.jpg","","117053"
"Fri Dec 15 14:08:53 +0000 2023","1735663222290534454","Covid balik lg yach?? https://t.co/1fD626fVqk","3","12","3","209","in","82558238","1735663222290534454","putpuwi","https://twitter.com/putpuwi/status/1735663222290534454","https://pbs.twimg.com/media/GBZQfLXWwAAKwEX.jpg","","9724"
"Fri Dec 15 07:42:16 +0000 2023","1735565927092249048","member share kt wasap pi urus jenazah covid full attire. dejavu lah. mask up gais. tak susah. https://t.co/oVQO1HgkMo","31","5","1523","2027","in","43060807","1735565927092249048","ajipkasa","https://twitter.com/ajipkasa/status/1735565927092249048","https://pbs.twimg.com/ext_tw_video_thumb/1735565917751476224/pu/img/wGy1zP_rGuG8tK7u.jpg","","784"
"Fri Dec 15 13:14:22 +0000 2023","1735649501111889956","Mbulet 😳  Nyalahin angin.. Nyalahin alat indikator covid.. Padahal gak becus kerja.  Kita bukan mau tidur sehingga yg dicari tukang dongeng. Tp yg kita cari seorang pemimpin negeri ini. Seseorang yg dapat bekerja melanjutkan pekerjaan pakdhe.  @prabowo @gibran_tweet Gas poll✌️ https://t.co/l6BDaNvAkv","7","112","35","106","in","834268510939287552","1735649501111889956","ApriliaLin","https://twitter.com/ApriliaLin/status/1735649501111889956","https://pbs.twimg.com/ext_tw_video_thumb/1735649457642123264/pu/img/NXvf_XsMag8IZMwQ.jpg","DKI Jakarta, Indonesia","32089"
"Fri Dec 15 12:41:40 +0000 2023","1735641271614533764","Alumni 😂 ya gimana yak chancenya low bgt bisa ketemu (org baru) lgsng di real life lol. Apalagi pas covid ye. Kadang malu ditanya padahal lumayan lumrah jaman skg ketemu lewat dating app ishh. Pic terakhir mamah gw yg selalu mesam2 kalau diajak ngobrol🤣 https://t.co/XgfDPFptRc","5","14","18","220","in","328288615","1735641271614533764","worldgonnaknow","https://twitter.com/worldgonnaknow/status/1735641271614533764","https://pbs.twimg.com/media/GBY8hk_XMAAVeWS.jpg","Copenhagen, Denmark","1585"
"Fri Dec 15 09:32:55 +0000 2023","1735593772074070506","Buku ni cakap pasal remote work.   Tahu bila Tim Ferriss publish buku ni? 2008. 2008 wehhhhh dia cakap pasal remote work!!!  Betul la orang cakap  orang bijak ni fikiran dia memang ke hadapan. Kita ni masa COVID baru first time dengar pasal 'remote' work 😭😭😭 https://t.co/Bbtu8eKXaT","5","6","132","557","in","2485368801","1735593772074070506","thegrxyvibe","https://twitter.com/thegrxyvibe/status/1735593772074070506","https://pbs.twimg.com/media/GBYRSz-b0AAjUeN.jpg","Vietnam","18623"
"Fri Dec 15 12:06:37 +0000 2023","1735632449408028831","Selamat bercuti Cuti Penggal 3  Sesi 2023/2024. Manfaatkan cuti anda dengan aktiviti-aktiviti berfaedah.   Amalkan langkah berjaga-jaga. Bendung penularan wabak COVID-19.  #7TerasKPM #MalaysiaMADANI #KaramahInsaniah https://t.co/dGHJoOyjbq","2","1","18","50","in","517135260","1735632449408028831","KemPendidikan","https://twitter.com/KemPendidikan/status/1735632449408028831","https://pbs.twimg.com/media/GBY0gghaQAA6oNP.jpg","","175238"
"Fri Dec 15 20:30:45 +0000 2023","1735759318723829994","covid jo si aiduh","0","2","0","5","in","867044009486696449","1735759318723829994","aaidaz1z_","https://twitter.com/aaidaz1z_/status/1735759318723829994","","Kota Kinabalu, Sabah","976"
"Fri Dec 15 16:24:28 +0000 2023","1735697341032907152","Covid tidak pernah ada!  Ini juga telah lama dikonfirmasi oleh para peneliti dan penulis studi utama tentang SARS-CoV-2 dari Australia.  Jadi hindarilah hal-hal terkait dengannya #EverythingScam https://t.co/NIpiMHjcUg","2","0","27","39","in","80366659","1735697341032907152","_Banyoe","https://twitter.com/_Banyoe/status/1735697341032907152","https://pbs.twimg.com/media/GBZviJNaQAAwcP4.jpg","Manchester, England","12335"
"Fri Dec 15 12:03:49 +0000 2023","1735631747038277994","Karena Lutfi penjilat penguasa pir makany gk petnah jadi Napi .  Harus di kasus covid dia juga harusnya dibui krn dia tetap adakan keramaian","2","20","90","353","in","1682627008017350657","1735631747038277994","Resty_J_Cayah","https://twitter.com/Resty_J_Cayah/status/1735631747038277994","","","19509"
"Fri Dec 15 08:22:27 +0000 2023","1735576037075857768","MKAKATI WA KUMSHAMBULIA NAPE NI KUFUNIKA SUALA LA KINA MDEE NA WENZIE.   Kiini macho cha suala la wabunge 19 viti maalum CHADEMA maarufu kama COVID-19 limechukua sura mpya baada ya mahakama kuweka zuio la kuvuliwa Ubunge na kulirudisha kwenye baraza la rufaa Chadema.  Mkakati wa… https://t.co/D4axaeDRXD","2","34","18","64","in","2724063808","1735576037075857768","420Cousin","https://twitter.com/420Cousin/status/1735576037075857768","https://pbs.twimg.com/amplify_video_thumb/1735575201646034944/img/CwR08qP7CguTlhqL.jpg","Dar es Salaam, Tanzania","16062"
"Fri Dec 15 18:48:38 +0000 2023","1735733622924251192","Kukira gabisa nyium gara” covid  ternyata bukan milik ku….","0","6","1","6","in","1241822753713344512","1735733622924251192","abebnsrlim","https://twitter.com/abebnsrlim/status/1735733622924251192","","Jakarta","7459"
"Fri Dec 15 16:27:20 +0000 2023","1735698064231596322","WASPADA JANGAN TERTIPU KEDUA KALINYA  Kita Wajib Curiga Kalau Isu COVID-19 Akan Digunakan Untuk Memuluskan Kecurangan Pemilu Nanti https://t.co/ZTrXwbWNQJ","0","1","2","4","in","1702971286392315904","1735698064231596322","SulisteaT40686","https://twitter.com/SulisteaT40686/status/1735698064231596322","https://pbs.twimg.com/media/GBZwL_daQAAq8Us.jpg","","1379"
"Fri Dec 15 06:48:35 +0000 2023","1735552415842418852","CF mau dikecilin lagi...... juga impossible at this point... masa iya dibalikin lg ke balai kartini  padahal post covid yg dateng ke CF naik 2x lipat dr pre-covid.. 🫠 yg ada itu jd sarden bumbu kuning semua yg ke CF /j","10","5","19","136","in","1087998884163579910","1735552415842418852","_niiyou","https://twitter.com/_niiyou/status/1735552415842418852","","i draw what i love","5467"
"Fri Dec 15 13:51:48 +0000 2023","1735658922609135921","@Gank_Of_Petojo Jd selama covid cuma ada 1 Pelanggaran  tidak ada yg lain hanya IBHRS. Bagi org yg msh punya akal sih harusnya mikir  https://t.co/URUU0J9fNY","0","3","11","47","in","1539140174302552067","1735625828053200912","stepupreneur","https://twitter.com/stepupreneur/status/1735658922609135921","","","82"
"Fri Dec 15 08:01:22 +0000 2023","1735570732804177984","Tolonglah jangan breakout covid lagi. Cukuplah dulu aku merasa jaga pesakit covid.   Pesakit gasping for air. Orang sakit menunggu sebelah mayat sebab port oxygen terhad dan mortuary penuh.   Anak-anak yatim kehilangan ibu bapa ketika covid.  Penat mental dan fizikal.","1","0","4","6","in","1697120689","1735570732804177984","A_Newaza","https://twitter.com/A_Newaza/status/1735570732804177984","","","810"
"Fri Dec 15 18:08:52 +0000 2023","1735723612601192829","Jurnalis Liz Gunn bergabung dengan Maria Zeee setelah merilis data yang paling memberatkan hingga saat ini mengenai kejahatan COVID  dgn data whistleblower Kementerian Kesehatan Selandia Baru yang menunjukkan kematian warga NZ langsung dari suntikan COVID. https://t.co/9q7UMyCvJE","1","1","7","12","in","80366659","1735722877981454664","_Banyoe","https://twitter.com/_Banyoe/status/1735723612601192829","https://pbs.twimg.com/ext_tw_video_thumb/1735723588978872320/pu/img/zAzVD4PjMAbHxuR7.jpg","Manchester, England","12335"
"Fri Dec 15 21:28:29 +0000 2023","1735773849436987732","Dan satu2nya menteri yang menolak impor vaksin covid  makanya harus digeser karena tidak sesuai dengan skenario WHO   Bill Gates dan World Bank.","0","1","1","0","in","100127625","1735773849436987732","GubernurPribumi","https://twitter.com/GubernurPribumi/status/1735773849436987732","","Jakarta Capital Region, Indone","844"
"Fri Dec 15 12:01:11 +0000 2023","1735631085147766843","Covid-19 Muncul di DIY  Sultan Minta Wisatawan Kantongi Sertifikat Vaksin Ketiga https://t.co/Mup8GcGwQK #beritajogja #jogja #jogjaistimewa https://t.co/VMtMS0q4VJ","4","6","6","10","in","118371948","1735631085147766843","Harian_Jogja","https://twitter.com/Harian_Jogja/status/1735631085147766843","https://pbs.twimg.com/media/GBYzRi-bQAADuSa.jpg","Yogyakarta, Indonesia","190568"
"Fri Dec 15 17:00:24 +0000 2023","1735706382371090559","@Gank_Of_Petojo Mungkin IBHRS satu2nya orang di dunia yg dihukum penjara terkait COVID-19...","0","6","31","143","in","80559922","1735625828053200912","ferizandra","https://twitter.com/ferizandra/status/1735706382371090559","","In her dream...","13320"
"Fri Dec 15 10:14:23 +0000 2023","1735604204981657866","Aku nak share something from Prof. Fukushima Masanori (currently at kyoto university)  Berikut adalah data jangkitan pada julai 2021 dan 2022.  Dekat sebelah kiri 2021 (yang aku bulat merah tu) adalah kadar kematian patients from covid.  2022 tidak diletakkan data yang sama. https://t.co/P0qQElgL9y","0","3","17","22","in","4313010322","1735604204981657866","EastMister0822","https://twitter.com/EastMister0822/status/1735604204981657866","https://pbs.twimg.com/media/GBYZ0O0aQAAHCv_.jpg","Malaysia","1276"
"Fri Dec 15 09:37:26 +0000 2023","1735594906947899521","Gue inget banget kalau kejadian kenaikan kasus menjelang puasa/lebaran  sama covid-denial suka dibilang "Tuh kan pasti biar umat muslim ga lebaran dst dst dst".  Sekarang belum liat yang ngomong "ini pasti biar pada ga natalan".","1","2","35","54","in","36551612","1735594906947899521","catuaries","https://twitter.com/catuaries/status/1735594906947899521","","-6.769565940997219, 106.963877","17072"
"Fri Dec 15 12:21:15 +0000 2023","1735636134930305518","Apakah di penghujung 2023 ini masih ada orang yang paranoid terhadap berita "naiknya kasus covid" di Jakarta  lalu minta tambah suntik vaksin lagi?  Nek ono yo guobloke nemen rek.","2","15","6","31","in","1510927488146305025","1735636134930305518","clairvoyant_cl","https://twitter.com/clairvoyant_cl/status/1735636134930305518","","on the sea","1180"
"Fri Dec 15 13:41:41 +0000 2023","1735656376222052551","buat kalian yang ke cf  stay safe  kasus covid lagi naik    jangan lupa pake masker guys👍","1","0","2","3","in","1493168421387005952","1735656376222052551","malvv__","https://twitter.com/malvv__/status/1735656376222052551","","","304"
"Fri Dec 15 16:18:52 +0000 2023","1735695932967288857","Kes bunuh dekat Malaysia dah macam kes covid Bagai cendawan tumbuh selepas hujan https://t.co/B381GHJ16m","0","1","1","2","in","257741184","1735695932967288857","afifhaidzir","https://twitter.com/afifhaidzir/status/1735695932967288857","https://pbs.twimg.com/tweet_video_thumb/GBZuPrRa0AAtJ4J.jpg","","524"
"Fri Dec 15 15:30:15 +0000 2023","1735683695452082313","@sociotalker Rasanya ga mungkin ga bisa mengerti soal polusi yg bisa tertiup angin  emang dasarnya mereka membodohi diri sendiri aja dan maunya mengolok-olok doang  atau emang listening comprehension nya yg kurang kek capres pilihannya saat Anies jelasin pake analogi alat test covid","0","7","12","198","in","1378874700521033732","1735675358978949239","merseysideliv","https://twitter.com/merseysideliv/status/1735683695452082313","","","62"
"Fri Dec 15 15:18:46 +0000 2023","1735680808231616933","[Tribun Jogja] Pernyataan Menkes soal Kenaikan Kasus Covid-19 di Sejumlah Daerah : Masih dalam Batas Normal https://t.co/PzulaC5ucH https://t.co/ZJFka7qQpt","0","0","0","1","in","82309015","1735680808231616933","kla10_","https://twitter.com/kla10_/status/1735680808231616933","https://pbs.twimg.com/media/GBZgf20bIAA3TCV.jpg","Klaten","9492"
"Fri Dec 15 16:07:15 +0000 2023","1735693009839395038","Kata gue teh KOK GAMPANG BGT FLU?!!! CAPEEEE GUE SEMENJAK COVID lahir ke dunia  emang wuhan bangke","0","1","0","2","in","416750462","1735693009839395038","fevi_istiaan","https://twitter.com/fevi_istiaan/status/1735693009839395038","","ID 🇮🇩","1034"
"Fri Dec 15 11:37:23 +0000 2023","1735625093609656443","Salah satu keberhasilan utama Jokowi di masa pemerintahannya adalah TIDAK MENERAPKAN LOCKDOWN saat pandemi Covid-19.  Di saat desakan lockdown sangat kuat menerpa Jokowi  ada seseorang yang menelepon Jokowi. Penelepon itu ternyata....(simak tuntas)  #PDIPerjuangan https://t.co/STcYQVxMRU","0","1","6","13","in","168052875","1735625093609656443","ariabima99","https://twitter.com/ariabima99/status/1735625093609656443","https://pbs.twimg.com/ext_tw_video_thumb/1735625004849770496/pu/img/IngcZihZ3GK-7A6y.jpg","Solo-Jakarta PP","36042"
"Fri Dec 15 13:35:06 +0000 2023","1735654720105247165","DEMI APAPUN INI GUA COVID APA BEGIMANA  ROKOK GA ADA RASANYA","0","7","0","0","in","1697997527600263168","1735654720105247165","izzabrar","https://twitter.com/izzabrar/status/1735654720105247165","","Bekasi","82"
"Fri Dec 15 21:20:51 +0000 2023","1735771928416154105","ini apa gua kenak covid varian baru itu ya","0","0","0","1","in","1147894049002512384","1735771928416154105","lovelyxrush","https://twitter.com/lovelyxrush/status/1735771928416154105","","jkt","1900"
"Fri Dec 15 09:05:12 +0000 2023","1735586797877665896","Kalau sakit Covid sekarang tidak lagi ditanggung ama BPJS ya @ardi_tama1 ?","0","1","0","1","in","64622098","1735586797877665896","mbahndi","https://twitter.com/mbahndi/status/1735586797877665896","","Ikhlas Sabar Sadar ","82933"
"Fri Dec 15 21:21:24 +0000 2023","1735772068879405162","Gila barai sia this week  head kau kene covid. Settled everything sorg  then now aku dh start nk selsema and asyik bersin je ni🥲🥲🥲 dh la lagi bape hari je nk pi compy trip👀👀👀","0","1","0","2","in","1900246518","1735772068879405162","Mrs_rmm","https://twitter.com/Mrs_rmm/status/1735772068879405162","","","47"
"Fri Dec 15 10:15:45 +0000 2023","1735604552127442952","Covid vaksin adalah vaksin pertama aku dengar di mana 80% vaccination tak mampu mencapai herd immunity.  Vaksin terpaling bebal.","0","1","9","28","in","1690700485664391168","1735604552127442952","JimushiJubei","https://twitter.com/JimushiJubei/status/1735604552127442952","","","591"
"Fri Dec 15 11:41:53 +0000 2023","1735626225748725825","@ezash Rakit PC  20jt udah cakep itu sih  selama laptop untuk kerja udah punya ya..   Pc alakadarnya  spek jaman covid I7 9700 2x8gb 3060 Hdd ssd nvme   Abis sekitar 11-12an   Utk saat ini game cmn fishing planet aja 😂 udah cukup banget https://t.co/kj4zHS4xNn","1","3","0","5","in","101665453","1735619893851218121","bayudwk","https://twitter.com/bayudwk/status/1735626225748725825","https://pbs.twimg.com/media/GBYu17ibwAABXUn.jpg","☆Sidoarjo","619"
"Fri Dec 15 15:53:58 +0000 2023","1735689666266112175","Please jgn. Dulu arwah mak meninggal sbb covid  aku dpt rentas balik kg pun tk dpt tgk jenazah. Masa tu dkt kubur aku jdi blur mcm org tkde perasaan tk tau nak react mcm mana. Aku tk dpt peluk family aku sbb diorang semua close contact. Sakit do. Aku nangis sorang2  lepastu. https://t.co/98SjvbZ0kA","0","0","0","4","in","431378045","1735689666266112175","syahh_shddin","https://twitter.com/syahh_shddin/status/1735689666266112175","https://pbs.twimg.com/media/GBZoh6IakAApSh4.jpg","Muar ✈ Subang","559"
"Fri Dec 15 22:13:29 +0000 2023","1735785174099730647","Musim hujan dan musim covid meningkat nie  stay safe ye gaiss 🤍  Moga dipermudahkan urusan semua orang 🤲🏻✨","0","0","0","3","in","1286573660111638528","1735785174099730647","wileyyyx","https://twitter.com/wileyyyx/status/1735785174099730647","","","728"
"Fri Dec 15 17:00:14 +0000 2023","1735706342953046288","Mengada nak doa lockdown kenapa ek. We cant afford another lockdown. Just jaga je lah diri tu  pakai mask  elakkan tempat crowded  guna sanitizer. Ni ko dah sakit mengada pulak jumpa org. Bodoh. Pastu bila covid naik harap lockdown sebab u priviledged. Another bodoh.","0","1","1","2","in","1508706368748134401","1735706342953046288","weevee27","https://twitter.com/weevee27/status/1735706342953046288","","Petaling, Wilayah Persekutuan ","2945"
"Fri Dec 15 12:54:16 +0000 2023","1735644443724923340","@jokowi sejarah akan mencatat   pembangunan tercepat NKRI di kepemimpinan Jokowi . walaupun ada jedah 3 thn pandemi covid 19 . kebanyakan masyarakat tdk mengerti fungsi oposisi yg hanya mengdikte . giliran di kasih posisi . tidak mampu kerja  . hanya tahu jual sertifikat .","0","1","1","18","in","826398415961485313","1735584494160421113","hutomowidjaya26","https://twitter.com/hutomowidjaya26/status/1735644443724923340","","","15"
"Fri Dec 15 14:34:05 +0000 2023","1735669562098516039","badan sakit semua gatau gegara covid atau emang efek kapitalisme","0","0","0","1","in","415359294","1735669562098516039","d00medyouth","https://twitter.com/d00medyouth/status/1735669562098516039","","","1073"
"Fri Dec 15 13:16:09 +0000 2023","1735649947855282184","Slh satu cara utk memantau peningkatan kes positif covid-19 adalah dgn cara menyekat kemasukan pelancung dari negara luar yg mempunyai peringkatan kes covid yg tinggi bkn nya diberi visa kemasukan secara mdh @Alamurni @Bossbm17 @bossku_team @zlk69 @BNrasmi https://t.co/fZrbn0UgfV","0","6","9","27","in","917414164896690176","1735649947855282184","Ayahanda_MD","https://twitter.com/Ayahanda_MD/status/1735649947855282184","","","8705"
"Fri Dec 15 12:58:39 +0000 2023","1735645546851848447","@Resty_J_Cayah Dipenjara gegara kasus covid dulu…  Padahal yg lain juga banyak bikin keramaian ga ngikutin protokol covid  termasuk lutfi juga jokowi https://t.co/gQ7q0Q1xvm","0","0","3","14","in","1604496541166829573","1735631747038277994","Udang_Rebon3","https://twitter.com/Udang_Rebon3/status/1735645546851848447","https://pbs.twimg.com/media/GBZAa_BW8AAe9RJ.jpg","","15"
"Fri Dec 15 12:47:18 +0000 2023","1735642687775428784","Semoga covid dihapuskan dari muka bumi Allah ini. Tak sanggup lagi nak pkp. Mentally tortured","0","0","1","4","in","1422511781411311616","1735642687775428784","haniehannn","https://twitter.com/haniehannn/status/1735642687775428784","","Malaysia","313"
"Fri Dec 15 15:29:37 +0000 2023","1735683536580133334","@AbeMicksuka Pengeluaran KWSP lebih RM90 billion during Covid era mempengaruhi juga GDP Malaysia 2022.  Muhyiddin juga gunakan RM600 billion perbelanjaan semasa Covid era : overspending. https://t.co/MlJWhXDzVJ","0","0","1","7","in","983700790987571200","1735563472170254556","LEOSQUEEN2020","https://twitter.com/LEOSQUEEN2020/status/1735683536580133334","https://pbs.twimg.com/media/GBZi-DIbkAAyzR6.jpg","","135"
"Fri Dec 15 11:11:04 +0000 2023","1735618470384210212","This is why certain places have low mortality sebab depa dah ada corona virus outbreak *enteral* eg Taiwan.  Bukan lagi cepat buat \/. This is natural immunity  something yg ditolak 'pakar' covid 3 tahun dahulu   sekarang depa krik3.","0","1","6","23","in","247305394","1735618470384210212","marinagamba1909","https://twitter.com/marinagamba1909/status/1735618470384210212","","#KelabMatahariSinanjungSuria","10191"
"Fri Dec 15 11:15:34 +0000 2023","1735619604482080989","Jokowi Minta Menkes Amati Perkembangan Kasus Covid-19 yang Terus Meningkat https://t.co/1SvFFrrL5b #beritasatu #debatcaprescawapres #bersatukawalpemilu","1","1","3","8","in","154102750","1735619604482080989","Beritasatu","https://twitter.com/Beritasatu/status/1735619604482080989","","Jakarta","1070946"
"Fri Dec 15 23:01:06 +0000 2023","1735797157310156824","Antisipasi Lonjakan Kasus Covid-19 di Masa Libur Natal 2023 https://t.co/DwZL6BzD67 #TempoGrafis","0","1","1","1","in","18129942","1735797157310156824","tempodotco","https://twitter.com/tempodotco/status/1735797157310156824","","Indonesia","2215501"
"Fri Dec 15 14:37:30 +0000 2023","1735670423340134897","Anjing kostum dugong upin ipin anjirrrr lagi covid pun aing ketawa kenceng banget ini udh malem anjing festish apaan tuh astagaaa bentar dugong upin ipin yg mana dah??🤣🤣🤣","0","1","1","0","in","1288401005869060096","1735670423340134897","Sashayi89","https://twitter.com/Sashayi89/status/1735670423340134897","","Thailand","2695"
"Fri Dec 15 12:25:42 +0000 2023","1735637255535161538","Pakai mask tapi personal hygiene tak jaga  tangan tak basuh sebelum remove mask. Hand rub pun malas. Lepas tu mask sekeping tulah hang pegi lanyak sampai lunyai.  MaSk TaK bOLeH sToP CoViD pUn  Get the fuck outta here.","0","0","9","2","in","1442995694","1735637255535161538","redrun_","https://twitter.com/redrun_/status/1735637255535161538","","In your pocket","6483"
"Fri Dec 15 11:42:01 +0000 2023","1735626262264377436","Jahat parah! Jika benar covid politisir buat menjegal kampanye lawan.Yang korban tetap rakyat.","0","0","0","1","in","1166419151423803393","1735626262264377436","b_otonom","https://twitter.com/b_otonom/status/1735626262264377436","","","1250"
"Fri Dec 15 18:10:12 +0000 2023","1735723951178064221","Dalam satu kelompok suntikan dalam jangka waktu dua jam  seluruh 51 orang yang disuntik dengan suntikan Covid di satu pusat di bagian bawah Pulau Selatan Selandia Baru kini semuanya meninggal.","0","1","2","6","in","80366659","1735722877981454664","_Banyoe","https://twitter.com/_Banyoe/status/1735723951178064221","","Manchester, England","12335"
"Fri Dec 15 19:50:19 +0000 2023","1735749144197660769","@BabaMwita Watasema uwepo wao tu kwenye kikao ni tatizo tayar ..kwamba watainfluence maamuzi ya wajumbe wengine. Hii game imechezwa kwa makusudi. Hata wakikaa tena Baraza Kuu na kuamua sahihi. Wale COVID-19 wataenda tena Kortini na kesi itaanza upyaaaaaaa na haitaisha hadi 2025.","0","3","0","21","in","1471955318200483845","1735734955563421812","gobore2018","https://twitter.com/gobore2018/status/1735749144197660769","","Tanganyika","250"
"Fri Dec 15 12:04:07 +0000 2023","1735631822464401830","@diethingy gue uda ngurangin gula dari jaman covid  eh pas semalem cek kesehatan malah kurang gula darah wkwk emngg yg berlebihan dan kekurangan itu gabaikk yaa","2","6","1","97","in","1282650966836129795","1735602108651737590","iambabbygurl","https://twitter.com/iambabbygurl/status/1735631822464401830","","secret number heart","203"
"Fri Dec 15 04:30:04 +0000 2023","1735517554762821972","Kasus Covid di Jateng Naik Jelang Libur Nataru  Legislator PKS Imbau Pemprov Lakukan Antisipasi  “Kasusnya naik lagi jelang libur nataru ini  harapannya Pemprov dan Pemda segera mempersiapkan antisipasi " ujar Ida Nurul Farida  https://t.co/BLsm56jivD","1","3","19","53","in","22365191","1735517554762821972","PKSejahtera","https://twitter.com/PKSejahtera/status/1735517554762821972","","TB. Simatupang No. 82, Jakarta","498669"
"Fri Dec 15 17:07:33 +0000 2023","1735708183958831520","Belajar dari COVID  Ini 4 Strategi Menkes Atasi Pandemik di Masa Depan https://t.co/7qhH4D4H15","0","0","0","1","in","388190238","1735708183958831520","IDNTimes","https://twitter.com/IDNTimes/status/1735708183958831520","","","401581"
"Fri Dec 15 09:57:08 +0000 2023","1735599864183238709","Dalam rumah aku 3 org kena covid  4 orang tak kena  Tapi yg kena memang selsema batuk sikit2 je  Pastu yg kena covid ni masak  yg tak kena covid makan masakan yg kena covid  Sorg tu jap lagi anniversary 7 tahun tak pernah demam 😂","1","1","0","0","in","1241282930401349633","1735599864183238709","iezasevda","https://twitter.com/iezasevda/status/1735599864183238709","","a practicing islam society","167"
"Fri Dec 15 13:00:43 +0000 2023","1735646066110820507","Jumlah kasus aktif Covid-19 di Indonesia pada 14 Desember 2023 meningkat hampir 300 kasus dari hari sebelumnya. Peningkatan kasus Covid-19 diperkirakan akan terus berlanjut selama masa libur akhir tahun 2023. #Kesehatan #AdadiKompas   https://t.co/7L62sHnyix","0","0","0","1","in","255866913","1735646066110820507","hariankompas","https://twitter.com/hariankompas/status/1735646066110820507","","Palmerah, Jakarta","1048445"
"Fri Dec 15 09:28:25 +0000 2023","1735592640647766484","Kementerian Kesehatan RI (Kemenkes) melaporkan adanya peningkatan kasus COVID-19. Sebanyak 22 provinsi dilaporkan mengalami peningkatan kasus mingguaS https://t.co/M74Bjng0nT","1","0","2","3","in","104446991","1735592640647766484","detikHealth","https://twitter.com/detikHealth/status/1735592640647766484","","Jakarta - Indonesia","1823123"
"Fri Dec 15 16:56:47 +0000 2023","1735705474627191117","@blank0429 Maaf jaman lockdown COVID emang PLTU ikutan tutup?  Kayaknya Ada Yang klaim sukses bikin Jakarta bebas polusi Pas lockdown COVID","0","2","0","2","in","249445876","1691252484462043136","rachmad2i","https://twitter.com/rachmad2i/status/1735705474627191117","","where you can find me | KL MY","22"
"Fri Dec 15 14:24:16 +0000 2023","1735667092563624068","Ko org masih ingt x kerajaan 22bln yg mula2 covid di malaysia tidak di cegah awal sbb menteri mangkuk ni la yg cakap covid ni kena matahari dah mati kuman sbb menteri bebal ni la covid di negara kita kritikal waktu itu nasib baik tukar kerajaan kalau tidak lago ramai yg mati","0","0","0","0","in","1731368324515405824","1735667092563624068","TeamWalabot","https://twitter.com/TeamWalabot/status/1735667092563624068","","","59"
"Fri Dec 15 04:26:44 +0000 2023","1735516719337312726","“ada yang vax pun still kene covid”  ???  covid-19 tu dah 4 tahun dah kalau ikutkan first outbreak on December 2019. but unfortunately  ada orang yang masih tak faham yang covid vaccine ni bukannya buatkan kau langsung takkan kena infected.   please educate yourself  buat malu je","0","1","0","5","in","77447512","1735516719337312726","faamxx","https://twitter.com/faamxx/status/1735516719337312726","","waifu mirul 🌼","704"
"Fri Dec 15 19:27:13 +0000 2023","1735743330343064054","@ibjela Benar… semua perkara yg terjadi dalam hidup ni kerana Allah  yakin dgn Allah. Bukan yakin dgn makhluk. Covid kaa  vaksin covid kaa  segala jenis ubat kaa… semua tuu makhluk. Yang bagi sembuh  bagi sihat  kehidupan  semua dari Allah. Berubat tuu usaha  asbab kesembuhan sahaja.☝️","0","0","1","2","in","1411414141","1735549795761274925","BadryelBaharom","https://twitter.com/BadryelBaharom/status/1735743330343064054","","Kuala Lumpur, Wilayah Persekut","145"
